{
  "schema_version": "1.0",
  "model": {
    "components": [
      {
        "kind": "voigt",
        "prefix": "p1",
        "parameters": {
          "area": {
            "value": 4.0,
            "min": 0.0,
            "max": null,
            "fixed": false
          },
          "center": {
            "value": -1.3,
            "min": null,
            "max": null,
            "fixed": false
          },
          "gaussian_fwhm": {
            "value": 0.65,
            "min": 0.0,
            "max": null,
            "fixed": false
          },
          "lorentzian_fwhm": {
            "value": 0.35,
            "min": 0.0,
            "max": null,
            "fixed": false
          }
        },
        "tail": "higher"
      },
      {
        "kind": "voigt",
        "prefix": "p2",
        "parameters": {
          "area": {
            "value": 2.5,
            "min": 0.0,
            "max": null,
            "fixed": false
          },
          "center": {
            "value": 1.3,
            "min": null,
            "max": null,
            "fixed": false
          },
          "gaussian_fwhm": {
            "value": 1.0,
            "min": 0.0,
            "max": null,
            "fixed": false
          },
          "lorentzian_fwhm": {
            "value": 0.35,
            "min": 0.0,
            "max": null,
            "fixed": false
          }
        },
        "tail": "higher"
      }
    ],
    "offset": {
      "value": 0.03,
      "min": null,
      "max": null,
      "fixed": false
    }
  },
  "background": {
    "kind": "none"
  },
  "fit": {
    "max_evaluations": 300,
    "budget_seconds": 2.0
  },
  "source": {
    "mode": "demo",
    "points": 512,
    "pattern": "both"
  },
  "cadence_seconds": 0.25,
  "queue_size": 4,
  "output_dir": "outputs",
  "units": {
    "x": "eV",
    "y": "intensity"
  }
}
